{
    "$schema": "http://json-schema.org/draft-07/schema#",
    "$id": "https://raw.githubusercontent.com/szv/BachelorArbeit2_Szvetecz/main/Schema/device.schema.json",
    "title": "Device",
    "description": "A device, contained by a project.",
    "type": "object",
    "properties": {
        "setupId": {
            "description": "An UUID/GUID which is used to identify the device during registration.",
            "type": "string",
            "pattern": "^[0-9a-fA-F]{8}\\-?[0-9a-fA-F]{4}\\-?[0-9a-fA-F]{4}\\-?[0-9a-fA-F]{4}\\-?[0-9a-fA-F]{12}$"
        },
        "name": {
            "description": "The name of the device.",
            "type": "string",
            "minLength": 5,
            "maxLength": 200
        },
        "description": {
            "description": "The description of the device.",
            "type": "string",
            "maxLength": 1000
        },
        "interval": {
            "type": "number",
            "description": "The time that elapses between the transmissions of the data. (seconds)",
            "minimum": 1,
            "maximum": 99360,
            "default": 3600
        },
        "actors": {
            "type": "array",
            "uniqueItems": true,
            "items": {
                "$ref": "https://raw.githubusercontent.com/szv/BachelorArbeit2_Szvetecz/main/Schema/actor.schema.json"
            }
        },
        "measurements": {
            "type": "array",
            "uniqueItems": true,
            "items": {
                "$ref": "https://raw.githubusercontent.com/szv/BachelorArbeit2_Szvetecz/main/Schema/measurement.schema.json"
            }
        }
    },
    "required": ["setupId", "name", "interval"]
}