{
  "setupId": "9d7f453b-aa83-4d39-ac41-15ef6c7a6a80",
  "name": "device1",
  "description": "A device",
  "interval": 60,
  "actors": [
    {
      "name": "actor1",
      "description": "A actor",
      "type": "switch"
    }
  ],
  "measurements": [
    {
      "name": "measurement1",
      "description": "A measurement",
      "unit": "celcius",
      "interval": 20
    }
  ]
}